{
  "schema_version": "0.2.0",
  "scenario_id": "scenario:mvp2-classical-npc",
  "name": "MVP 2 classical NPC district",
  "version": "0.2.0",
  "purpose": "Prove coherent daily activity, action-channel exclusion, resource conservation, and perception gating without LLM calls.",
  "base_world": {
    "world_id": "world:mvp1-reference-district",
    "world_version": "0.2.0"
  },
  "start_time": "2042-05-04T00:00:00Z",
  "time_zone": "UTC",
  "geographic_extent": {
    "place_id": "district:reference"
  },
  "data_source_ids": [
    "AWG-DATA-011"
  ],
  "population": {
    "scheduled_agents": 100,
    "cognitive_agents": 0,
    "embodied_agents_max": 100
  },
  "organizations": [
    {
      "organization_id": "org:civic-office"
    },
    {
      "organization_id": "org:district-cafe"
    }
  ],
  "plugins": [],
  "models": [],
  "random_streams": [
    {
      "stream_id": "random:mvp2-utility",
      "owner": "npc-utility",
      "seed": 3001
    }
  ],
  "initial_conditions": [
    {
      "type": "load_offline_bundle",
      "bundle": "examples/mvp1-district/bundle.json"
    },
    {
      "type": "load_society",
      "bundle": "examples/mvp2-npc/society.json"
    }
  ],
  "scheduled_events": [],
  "interventions": [],
  "measurements": [
    "metric:daily-places-visited",
    "metric:resource-conservation",
    "metric:perception-leakage"
  ],
  "stop_conditions": [
    {
      "type": "simulation_time",
      "at": "2042-05-05T00:00:00Z"
    }
  ],
  "assumption_ids": [
    "AWG-ASM-009"
  ],
  "risk_ids": [
    "AWG-RISK-001",
    "AWG-RISK-003"
  ],
  "validation_profile": "validation:mvp2-classical-npc-v1",
  "created_by": "system:awg-reference-fixture",
  "created_at": "2026-08-21T00:00:00Z"
}
